,Tweets,len,ID,USER,userName,User Location,Language,Date,Source,Likes,Retweets,Geo,Coordinates,Place
82,"Dr. Anthony Fauci warns of ""anti-science bias"" being a problem in the United States https://t.co/wY7wV2FzDG https://t.co/GrMYStEqs9",131,1273852037172781056,CNNPolitics,CNN Politics,"Washington, DC",,2020-06-19 05:36:07,SocialFlow,3444,784,,,
83,"Remarks by Pres. Moon(@moonriver365) During Visit to Business in Digital Economy, Korean Version of New Deal  ""Government is pushing for a Korean version of the New Deal to overcome the COVID-19 crisis and respond to the post-COVID-19-era.""  ▶Full text  :https://t.co/ywdzyvogvt https://t.co/Cnnv8At6JG",302,1273849798529974272,TheBlueHouseENG,The Office of President Moon Jae-in,"Seoul, Republic of Korea",,2020-06-19 05:27:13,Twitter for Android,193,154,,,
84,"If Republicans fought as hard to stop the coronavirus as they fight to keep racist statues, the pandemic would be over",118,1273841172008452097,mrbenwexler,Ben Wexler,,,2020-06-19 04:52:56,Twitter for iPhone,480,88,,,
85,"Extending our warm birthday greetings to Shri @RahulGandhi Ji. Today, to commemorate the birthday of Shri Rahul Gandhi Ji's, AICC, Minority Department will celebrate 'Maanavata Diwas' and will help the needy people with relief materials who are affected due to COVID pandemic.",276,1273842221150683137,INCMinority,"Congress, Minority Department","New Delhi, India",,2020-06-19 04:57:07,Twitter for Android,270,111,,,
86,Coronavirus: India's Chennai re-enters lockdown as cases spike https://t.co/gEKnTgHCTm,86,1273837831375458304,BBCWorld,BBC News (World),"London, UK",,2020-06-19 04:39:40,SocialFlow,319,111,,,
87,"During this pandemic, no one is coming to save us, especially not the ones in charge. Rev. Derrick DeWitt, director of the Maryland Baptist Aged Home in West Baltimore, knew that. And jumped into action in February. Absolutely incredible. https://t.co/3c9wjR0rMa",262,1273844546208763904,katiemaryrich,Katie Rich,A Hammock between Over & Next,,2020-06-19 05:06:21,Twitter for iPhone,966,150,,,
88,Startups like @chaloapp &amp; CityCash in collaboration with @Paytm can drive significant revolution in cashless &amp; contactless ticketing in public transport system thereby heralding a new mobility ecosystem desired during the time of #COVID19 pandemic. https://t.co/67CFJ8Bhnb,280,1273848993332617222,Omkar_Raii,Dr.Omkar Rai #StayHome🏡 #StaySafe🇮🇳,New Delhi,,2020-06-19 05:24:01,Twitter for iPhone,177,190,,,
89,"We have been unfortunately caught napping by China: a country that past experience tells us should never be trusted.   The way forward:   Isolate China globally by demanding investigations on CoronaVirus spread; the deliberate lies, and opacity.   Stand resolute at the borders.",278,1273842877647347712,JhaSanjay,Sanjay Jha,Mumbai.India,,2020-06-19 04:59:43,Twitter for iPhone,586,118,,,
90,"All things considered, Trump and Cuomo led the way to my dads death. https://t.co/iRbD874TB4",92,1273837473290829826,dasracist,@himanshu,ny,,2020-06-19 04:38:15,Twitter for iPhone,118,21,,,
